{
  "schema_version": 1,
  "reader": "A program lead deciding which example request to review next",
  "decision": "Choose a request or recover from a non-ready state",
  "source": "Example request fixture included in this example",
  "output": "One offline, responsive web-app prototype",
  "medium": "web-app",
  "tone": "plainly useful",
  "constraints": [
    "No remote resources, network requests, storage, authentication, or backend claims",
    "Expose loading, empty, error, ready, and long-content states"
  ],
  "facts": [
    {
      "id": "fact.example.queue-count",
      "text": "The ready-state fixture contains three example requests.",
      "state": "proposed",
      "source": "Example fixture"
    },
    {
      "id": "fact.example.review-boundary",
      "text": "Selecting a request changes only this in-memory prototype view.",
      "state": "confirmed",
      "source": "Prototype implementation"
    }
  ]
}
